hallazgo_id,plan_id,auditor,name_hallazgo,capitulo,dependencia,descripcion,causa,efecto
52,14,phpulido1,1. La STRT al m,,STRT,"1. La STRT al momento de la visita de verificación de información el día 6 de marzo, no contaba con un inventario actualizado de software y hardware, con los atributos necesario para aportar como soporte al cuestionario de la DNDA.",No se han asignado formalmente los roles y las responsabilidades de administración de los inventarios de HW y SW del IDU a los funcionarios involucrados.,
53,14,phpulido1,2. Se observa q,,STRT,"2. Se observa que los registros de hardware como de software no tienen asociada la placa del inventario con el nombre lógico del elemento, es necesario consolidar la información con estos atributos para facilitar los procesos de seguimiento que requiera la Entidad.",No se cuenta con las restricciones tecnológicas posibles para evitar el traslado de equipos de cómputo sin autorización.,
54,14,phpulido1,3. La informaci,,STRT,"3. La información aportada , no se ajustaba en cantidades con las que se encontraba registrada en el sistema STONE y no está siendo conciliada con los registros contables de este sistema.",No se cuenta con las restricciones tecnológicas posibles para evitar la instalación o desinstalación de software en el Instituto.,
55,14,phpulido1,4. Evaluar la p,,STRT,"4. Evaluar la pertinencia de utilizar dos herramientas que tienen el mismo objetivo, un producto ARANDA con licenciamiento propietario adquirido por el IDU y  SpiceWorks un software libre que esta implementado para el mismo fin.",No se cuenta debidamente implementada la Herramienta de apoyo de la mesa de servicios para el control de inventarios de HW y SW,
56,15,phpulido1,Hallazgo 1: Def,,STRT,"Hallazgo 1: Definir procesos y procedimientos asociados con el desarrollo del objeto del contrato
914 de 2013, dado que en el acta de liquidación, se indica que el contrato fue terminado a satisfacción el 27 de febrero de 2014.","Ausencia de procedimientos que permitan conocer las funcionalidades, los procesos y la administración del sistema de acceso.  ",
57,15,phpulido1,Hallazgo 2: Imp,,STRT,Hallazgo 2: Implementar una estructura operacional para atender los potenciales procesos que ofrece el sistema de control de acceso y el aprovechamiento de la información ofrecida por el sistema.,"Ausencia de procedimientos que permitan conocer las funcionalidades, los procesos y la administración del sistema de acceso.  ",
58,15,phpulido1,Hallazgo 3: Def,,STRT,"Hallazgo 3: Definir procesos a fin de que la Entidad asuma el software de control de acceso como proceso interno, que incluya la administración del sistema, de ser necesario soportados en las obligaciones de contrato, en particular “Transferencia de conocimiento”, solicitado en el anexo técnico, CONDICIONES ESPECIALES DEL CONTRATO.","Ausencia de procedimientos que permitan conocer las funcionalidades, los procesos y la administración del sistema de acceso.  ",
59,15,phpulido1,Hallazgo 5: Fij,,STRT,"Hallazgo 5: Fijar un protocolo, en el que se especifique el mecanismo mediante el cual el IDU hace requerimientos de soporte de mantenimiento correctivo, en el que se genere evidencias de cuando son recibidas las solicitudes por el contratista y la atención de las mismas, con el fin de verificar el cumplimiento de los parámetros de calidad de servicio establecidos en el contrato.",Ausencias de protocolos para los requerimientos de soporte técnico correctivo.,
60,15,phpulido1,Hallazgo 7: Inc,,STRT,"Hallazgo 7: Incluir en la caracterización de los procesos del proceso “GESTION DE RECURSOS FISICOS”, actividades relacionadas con la administración de la seguridad física de a Entidad.","Ausencia de  actividades y productos en la caracterización de procesos de la gestión de Recursos Físicos, relacionados con la administración de la seguridad física de la Entidad.",
61,15,phpulido1,Hallazgo 8: Inc,,STRT,"Hallazgo 8: Incluir en el mapa de riesgos, los riesgos asociados a la administración del software del control de acceso, relacionados con el manejo no adecuado del sistema, la manipulación indebida de la información, impacto en la institución por perdida de la información entre otros.",Ausencia de riesgos referentes a la administración del sistema de control de acceso. ,
62,15,phpulido1,Hallazgo 9: Eva,,STRT,"Hallazgo 9: Evaluar el modelo de acceso a la red de datos del IDU, de los computadores con que se atiende la operación de entrada y salida de funcionarios en los puntos de acceso de las sedes de la Calle 20 y sede principal, para minimizar riesgos de seguridad de la información.",Los computadores con lo que se atiende la operación del sistema de acceso en la recepciones de la Entidad son propiedad del contratista de vigilancia y por ende existen riesgos en la seguridad de la información,
63,15,phpulido1,Hallazgo 10: Co,,STRT,Hallazgo 10: Constatar que la totalidad de requerimientos de parametrización queden incorporados en la fase de mantenimiento del contrato.,Configuraciones pendientes de realizar al sistema de control de acceso.,
64,15,phpulido1,Hallazgo 11: Re,,STRT,"Hallazgo 11: Revisar y verificar que los procesos de selección abreviada de menor cuantía, se ajusten a los antecedentes y necesidades de la contratación, establecidos en los estudios y documentos previos y en relación a la oferta presentada por el proponente en desarrollo del proceso de selección.",Deficiencias en la formulación de procesos de contratación de apoyo a la gestión de la Entidad,
65,16,plleiva1,No se ha girado,,STESV,No se ha girado los rendimientos financieros del anticipo,No se ha girado los rendimientos financieros del anticipo,
66,17,cnforero2,Efectuada una r,,STRH,Efectuada una revisión al normograma se encontró que hay normatividad derogada y resoluciones vigentes que no se encuentran incluidas.,El normograma vigente no fue lo suficientemente revisado y socializado entre los servidores del proceso durante su construcción y de esta manera poder identificar correctamente la normatividad y regulación interna vigente aplicable.,
67,17,cnforero2,Durante la revi,,STRH,Durante la revisión realizada se encontró que a los funcionarios se les está vinculando el mismo día de la firma de posesión lo que significa que aunque se encuentren afiliados la cobertura por un accidente sólo inicia un día después.,"En cumplimiento de la normatividad vigente, la STRH ha actuado conforme a lo estipulado en la ley.",
68,17,cnforero2,No se evidencia,,STRH,"No se evidenciaron registros del reporte de ausentismo laboral  por parte de los responsables de las diferentes áreas a la STRH a excepción de los reportes de las incapacidades, indicando falta de control en el monitoreo al cumplimiento de los horarios laborales por parte de los funcionarios de las diferentes dependencias.",Desconocimiento de la responsabilidad de los jefes de área de reportar el ausentismo en su dependencia,
69,18,ccrussis1,Documentar el r,,SGJ,"Documentar el riesgo de no contar con pólizas de cumplimiento que amparen las responsabilidades estipuladas en los contratos de asesoría externa e identificar las acciones que lo mitiguen, que traten efectivamente los impactos que se puedan generar, en caso de materializarse este riesgo.","No se había detectado como riesgo de gestión, dada las particularidades de estos contratos en relación con los procedimientos.",
70,18,ccrussis1,• Se observa qu,,SGJ,• Se observa que los recursos disponibles iniciales no cubren el 41% del presupuesto del plan de contratación.,La Secretaria de Hacienda Distrial recorto el presupuesto mediante el cual se financian los contratos de prestación de servicios y de apoyo a la gestión.,
71,18,ccrussis1,• Se observa qu,,SGJ,"• Se observa que la SGGC solicitó anticipadamente el Certificado de Disponibilidad Presupuestal, sin embargo, las dependencias radicaron el 46% después del vencimiento de los contratos, como se describe en el siguiente cuadro",a) Incumplimiento del cronograma propuesto por la SGGC para el inicio del proceso de contratación y de la radicación de los documentos por parte de las áreas.,
72,18,ccrussis1,• Se evidencia ,,SGJ,"• Se evidencia que no se cumplió con la estrategia planeada toda vez que el 98% de las carpetas fueron radicadas en la SGGC sobre la fecha de terminación de los contratos 2014, pese que se encontraban expedidos el 90% de los CDP con 20 días de antelación, lo anterior ocasionó que los nuevos contratos se suscribieran sin la oportunidad planeada y con un posible afectación de la gestión y el cumplimiento de los objetivos del IDU.",a) Incumplimiento del cronograma propuesto por la SGGC para el inicio del proceso de contratación y de la radicación de los documentos por parte de las áreas.,
73,18,ccrussis1,• Se Observa qu,,SGJ,"• Se Observa que la SGGC solicitó a las Subdirecciones Generales los días 28 de noviembre de 2014 y el 08 de diciembre de 2014, remitir antes del 12 de diciembre de 2014 la información para la construcción del plan de contratación 2015., se observa que la última fecha de entrega fue el 7 de enero 2015 por parte de la SGI y la SGDU.",a) Incumplimiento del cronograma propuesto por la SGGC para el inicio del proceso de contratación y de la radicación de los documentos por parte de las áreas.,
74,18,ccrussis1,• El 80% de las,,SGJ,"• El 80% de las personas designadas como facilitadores en el proceso son contratistas, situación que impacta el proceso puesto que en alguno casos sus contratos vencen o no son renovados generando retrasos en el proceso de contratación, adicionalmente al requerirse la continuidad del proceso, esta responsabilidad recae sobre nuevos facilitadores quienes nunca han sido capacitados, lo cual representa un retroceso en la curva de aprendizaje y demanda mayor tiempo y esfuerzo en la SGGC al tener que volver a capacitarlos e iniciar el proceso desde cero.",a) Incumplimiento del cronograma propuesto por la SGGC para el inicio del proceso de contratación y de la radicación de los documentos por parte de las áreas.,
75,18,ccrussis1,• Se observa de,,SGJ,"• Se observa demora en la contratación de personal relacionado con la expedición de los certificados de estado de cuenta para trámite notarial, razón por la cual esta actividad presenta un lapso de tiempo significativamente mayor para la otorgación del certificado afectando de esta forma calidad en la prestación del servicio.",a) Incumplimiento del cronograma propuesto por la SGGC para el inicio del proceso de contratación y de la radicación de los documentos por parte de las áreas.,
76,18,ccrussis1,• Mediante memo,,SGJ,"• Mediante memorando SGGC -20155050002163 de fecha enero 6 de 2015, la SGGC solicitó a las áreas la identificación del facilitador designado con el fin de iniciar el proceso de planeación de la contratación de prestación de servicios de apoyo a la gestión. No obstante lo anterior el 36% de dependencias no reportaron así: Dirección General, Dirección Técnica de Diseño de Proyectos, Dirección Técnica de Gestión Contractual, Dirección Técnica de Proyectos, Dirección Técnica de Procesos Selectivos, Oficina Asesora de Comunicaciones, Oficina Asesora de Planeación, Oficina de Control Interno, Subdirección General Jurídica, Subdirección Técnica de Recursos Humanos.",a) Incumplimiento del cronograma propuesto por la SGGC para el inicio del proceso de contratación y de la radicación de los documentos por parte de las áreas.,
77,18,ccrussis1,• En las capaci,,SGJ,• En las capacitaciones realizadas por la SGGC los días 31 de octubre de 2014; 9 de enero de 2015; y 14 de enero de 2015 un ausentismo equivalente al 52%; 27% y 58% respectivamente.,a) Incumplimiento del cronograma propuesto por la SGGC para el inicio del proceso de contratación y de la radicación de los documentos por parte de las áreas.,
78,18,ccrussis1,• De acuerdo co,,SGJ,• De acuerdo con lo reportado por la SGGC) se evidencia un desgaste administrativo en el proceso teniendo en cuenta el comportamiento de devoluciones de documentación…,a) Incumplimiento del cronograma propuesto por la SGGC para el inicio del proceso de contratación y de la radicación de los documentos por parte de las áreas.,
79,19,phpulido1,El sistema ORFE,,STRF,"El sistema ORFEO administrado por la STRF, tiene un servicio de atención de mesa de ayuda específico para el sistema, con registro en hojas de cálculo EXCEL, con información de carácter general sobre las peticiones de los usuarios, que no cuenta con caracterización de los casos registrados con una metodología técnica adecuada al proceso.
 El registro de casos no es verificado por la S/T de Recursos Tecnológicos, perdiéndose la potencialidad de obtener información sobre el funcionamiento del sistema, oportunidad de mejoras en la funcionalidad y rendimiento, consolidación de una base de datos de conocimientos del sistema, entre otras oportunidades.","Se lleva un control en excel, pero no se han consolidado las estadisticas de manera formal ni con una metodología determinada; sin embargo se escalan los requerimiento de segundo nivel para que sean atendidos por la STRT",
80,19,phpulido1,El contrato de ,,STRF,"El contrato de mantenimiento IDU 2215 de 2013, se da por finalizado con el acta No 2 Terminación y Liquidación de contrato, la fecha real de terminación del contrato es el 26 de enero de 2015, al momento de la visita de auditoria se verificó que se estaba elaborando el proceso, lo que indica que a la fecha los equipos no tenían cubrimiento de mantenimiento correctivo y/o preventivo.",2- No se tiene presupuesto para contrato de mantenimiento. ,
81,19,phpulido1,Tomadas muestra,,STRF,"Tomadas muestras de tráfico sobre la red de datos entre la sede calle 20 y la sede calle 22, el medio muestra en lapsos de tiempos intermitencia.
Los servidores que reciben la petición del usuario antes de conectar a la base de datos, presentan intermitencia durante diferentes lapsos de tiempo, haciendo que se bloquee el sistema y obligando al usuario a reiniciar la aplicación.",4- El cableado de datos y eléctrico de la sede calle 20 es obsoleto.,
82,19,phpulido1,Cuando un usuar,,STRF,"Cuando un usuario detecta que la radicación falla, hace una revisión de los radicados generados y envía la información por correo a la mesa de ayuda ORFEO, quienes la registran; cuando los usuarios no detectan la situación oportunamente se genera un doble radicado para un mismo caso, que al ser detectado, solicitan a la mesa de ayuda ORFEO la eliminación del radicado duplicado.","5- El alto volumen de devoluciones que se está tramitando, han generado exceso de transacciones entre los sistemas Valoricemos y Orfeo.
5- Deficiencias en el código de la aplicación para la conexión a la base de datos en la creación de radicados.",
83,19,phpulido1,Con base en mon,,STRF,"Con base en monitoreos realizados con las diferentes herramientas disponibles en las distribuciones de los sistemas operativos LINUX instalados en los servidores de procesamiento del sistema ORFEO y las estadísticas que genera el motor de base de datos, el desempeño de cada componente tiene una ejecución adecuada de acuerdo a los requerimientos, pero al analizar la estructura como sistema, se generan sentencias al motor de la base de datos que extralimitan su capacidad de procesamiento (sesiones activas el motor de la base de datos con recursos asignados o en espera de asignación y consumo de recursos de las sesiones a nivel del motor de bases de datos).","8- Bloqueos en la operación del sistema, ya sea por capacidad de procesamiento o inconsistencias en el código que soporta la aplicación.",
84,19,phpulido1,Las dependencia,,STRF,"Las dependencias que generan correspondencia masiva, el funcionario que firma debe hacer el procedimiento de imposición de la firma radicado por radicado, lo que hace oneroso la funcionalidad. (generación de correspondencia masiva, para hacer más eficiente el proceso de la firma mecánica)","Este desarrollo de firma masiva se ha venido trabajando con la STRT y la STRF; sin embargo, ha sido necesario realizar ajustes debido a los últimos desarrollos realizados para la firma mecánica de oficios.",
85,19,phpulido1,Se evidenció qu,,STRF,"Se evidenció que la actividad programada por la STRT para el día 30 de marzo de 2015, no se contaba con el soporte necesario para identificar los ítems de configuración a nivel de sistema operativo y base de datos, que facilitaran la configuración de la plataforma tecnológica con los parámetros adecuados.
No contar con los ítem de configuración disponibles para la actividad programada para el 30 de marzo, ocasionó interrupción del servicio durante el día hábil del 31 de marzo, generando la no atención de en las ventanillas de radicación de la Entidad y no recibir solicitudes de devolución Valorización Acuerdo 180 de 2005, de igual forma el proceso de correspondencia interno tampoco se prestó.","7- No disponibilidad del módulo Base de Datos de la Gestión de Configuración (CMDB, por sus siglas en inglés) en la herramienta de gestión del proceso.",
86,18,ccrussis1,De acuerdo con ,,SGJ,"De acuerdo con el análisis realizado la Subdirección General Jurídica y la Dirección Técnica de Gestión Judicial dentro del personal de apoyo a la gestión, presentó contratistas que posterior al vencimiento del contrato continúan prestando sus servicios normalmente en el IDU sin nuevo contrato.","Las solicitudes realizadas de activación del ORFEO y/o sistemas de información, se realizan para que los contratistas descarguen la correspondencia, elaboren los informes finales, realicen Backup de las cuentas de Usuario y efectúen la recolección de los Paz y Salvo en cada una de las dependencias que se requieran.
 
 Tema pendientes correspondientes a las obligaciones y/o objeto contractual",
87,20,ccbernal2,5. Implementar ,,OTC,5. Implementar mayores controles a fin de que las cifras que se reportan en los informes evidencien la real gestión del Instituto en materia de solicitudes presentadas por los ciudadanos y atendidas por las áreas correspondientes.,las áreas STRT y STOP no entregan informacion completa y oportuna.,
88,20,ccbernal2,6. Fijar mayore,,OTC,"6. Fijar mayores medidas de control para realizar un seguimiento eficaz y oportuno a las solicitudes presentadas por los ciudadanos, a fin de evitar respuestas extemporáneas y futuros requerimientos.","El sistema orfeo ya no genera alertas al usuario para los terminos de respuesta 
 la entrega de base de datos por parte de la STRT es tardía",
89,20,ccbernal2,7. Reforzar la ,,OTC,"7. Reforzar la capacitación a las áreas y/o a los funcionarios y contratistas encargados de recibir y radicar las solicitudes a través del aplicativo ORFEO, de acuerdo con el Instructivo de Clasificación de requerimientos ciudadanos con código IN-AC-011 versión 1.0 y el Manual de Derechos de Petición con código MG-IDU-009 en versión 3.0, con el fin de orientar y direccionar de manera adecuada las solicitudes presentadas.","Estan clasificando mal los derechos de petición en radicación
 el manual de derechos de petición se encuentra en actualización",
90,20,ccbernal2,8. Mejorar la c,,OTC,"8. Mejorar la coordinación y comunicación entre las dependencias del instituto y la Oficina de Atención al Ciudadano a fin de establecer controles y tiempos de permanencia en las áreas responsables de dar trámite a las solicitudes presentadas por los ciudadanos, en aras de prestar un servicio claro y eficaz al ciudadano, de igual manera contar con una información oportuna y veraz.","se requiere prevenir a las áreas responsables del cumplimiento de los terminos de respuesta
 evidenciar las fallas de las áreas responsables",
91,20,ccbernal2,9. Evaluar ampl,,OTC,"9. Evaluar ampliar la atención al ciudadano a los puntos ubicados en los CADES y SUPERCADES, ya que bajo los lineamientos impartidos por el Decreto 197 de 2014 en sus artículos 6 y 12 , la administración debe propender por un servicio más próximo a los ciudadanos sin generar obstáculos.","No hay suficientes recursos 
 el personal de STOP no conoce todos los temas
 No existe las herramientas tecnologicas en todos los puntos",
92,21,clchauxq1,El reglamento I,,SGI,"El reglamento Interno del Comité SIGERDE, aun no se encuentra aprobado por el Comité, el mismo se encuentra en etapa de estructuración por la SGI para discusión de los integrantes del Comité y será el primer punto a tratan en el primer Comité SIGERDE a citar en el presente año durante el mes de Abril de 2015, una vez cuente con aprobación se adelantaran las actividades pertinentes de normalización en el SIG IDU con el apoyo de la OPA.(sic)",Las sesiones del Comité SIGERDE del año 2014 se enfocaron en divulgar el estado vigente del IDU dentro de la Gestión del Riesgo de Desastres y sus roles a nivel distrital y necesidades internas,
93,21,clchauxq1,La asistencia a,,SGI,"La asistencia a las sesiones de los integrantes del Comité SIGER, fue:- No asistieron a las reuniones: DTP, DTM, DTAF, STRF, STRH,STRT y en ninguna reunión se completó el mínimo de siete (7) integrantes, para sesionar conforme a lo determinado en la Resolución 22477 de 2014",Las sesiones del Comité SIGERDE del año 2014 se desarrollaron en una etapa critica del año y no era claro para los integrantes el alcance individual dentro de la Gestión del Riesgo de Desastres,
94,21,clchauxq1,Analizadas las ,,SGI,"Analizadas las tres (3) actas de sesiones de noviembre y diciembre de 2014, se observa que no están suscritas. La asistencia de los integrantes del Comité junto con los demás asistentes se registra en un mismo Formato Listado de Asistencia COD: FO-IDU 051_V 2.0. El posible extravió de los listados de asistencia, traería como consecuencia la perdida de validez de las actas, cuyo contenido registra la gestión incluida las decisiones tomadas por el Comité","Se registro la asistencia a las sesiones, mediante el Formato FO-IDU-051 Listado de Asistencia, el cual se anexo al Acta de cada reunión",
95,21,clchauxq1,No se registra ,,SGI,"No se registra evidencia del seguimiento y verificación al cumplimiento de los compromisos pactados y registrados en las reuniones de noviembre 24/ 2014, diciembre 15/2014 y diciembre 30/2014 del Comité SIGERDE, en las que se establecieron los compromisos descritos a continuación: o Asignar responsables (Titulares y Suplentes) al cuadro de redundancia de mando. Responsable: Estructura organizacional PIRE IDU 2013. (reunión nov 24/2014); o Formulación RAN continuidad negocio. Responsable SGGC (Dic. 15 /2015); o Asignaciones cuadro redundancia mando. Responsable: Estructura organizacional PIRE-IDU 2013-2014. (Dic.15/2015); o Asignaciones cuadro redundancia mando. Responsable: Estructura organizacional PIRE-IDU 2013-2014. (Dic. 30/2015)","No se registró literalmente en el Acta el seguimiento a los compromisos previos, pese a que en el desarrollo se evidenció que se hizo el seguimiento",
96,21,clchauxq1,La Secretaría T,,SGI,"La Secretaría Técnica del Comité SIGERDE, corresponde a la Dirección Técnica de Mantenimiento - DTM-, según literal g) del artículo 26º, de la Resolución 22477 DE 2014. No obstante, sus funciones las está desempeñando directamente esta Subdirección General. Por otra parte, la DTM no ha asistido a las sesiones realizadas.","Por las condiciones de premura y fortalecimiento en las que se desarrollaron las sesiones del Comité durante el 2014, la SGI asumió como lider la organización primaria del Comité",
97,21,clchauxq1,Dentro de las f,,SGI,"Dentro de las funciones del Coordinador del IDU para la gestión del riesgo de desastres, o sea la Subdirección General de Infraestructura, esta “promover programas de capacitación para todos los empleados y contratistas del Instituto.” según literal I artículo 8º de la Resolución 4130 de 2011, de las cuales no se evidencia su cumplimiento",Inicialmente se adelanto una etapa introductoria de conocimiento de la Gestión del Riesgo de Desastres a los integrantes del Comité,
98,22,clchauxq1,En Indagación r,,OTC,"En Indagación realizada a la Secretaria Técnica del Comité, se informó que no tenían las actas suscritas, que se estaba trabajando para obtenerlas, ya que la persona encargada de ellas, ya no trabajaba en el Instituto de Desarrollo Urbano - IDU. Además, la carpeta compartida - contentiva de estas - presentaba algunos inconvenientes que no permitían visualizarlas.",El proceso de formalización de las actas del comité no ha sido efectivo.,
99,22,clchauxq1,• De las nueve ,,OTC,"• De las nueve (9) sesiones obligatorias para el Comité Anti tramites y de Gobierno en Línea, no se realizaron tres (3), equivalente al 33% del total de las sesiones, por los siguientes motivos: Septiembre 10 de 2014: “El comité no se realizó por falta de material para la presentación del mismo” Noviembre 26 de 2014: “Sin Quórum” Febrero de 2015: No hubo Quorum • De las seis (6) sesiones restantes, equivalente al 67%, solamente una (1) tenía el quórum necesario para sesionar, la de junio de 2014, (realizado en julio 07 de 2014); conforme el art. 23, que reza: “El Comité Anti tramites y de Gobierno en línea del IDU……podrá sesionar con un mínimo del 50% más uno de sus integrantes.” 
 Por falta de quorum, se está incumpliendo con las funciones del Comité Anti trámites y de Gobierno en Línea.",La concurrida agenda de los directivos dificulta convocar a reuniones.,
