hallazgo_id,plan_id,auditor,name_hallazgo,capitulo,dependencia,descripcion,causa,efecto
100,22,clchauxq1,El Comité de la,,SGGC,"El Comité de la Subdirección General de Gestión Corporativa, de Sostenibilidad Contable, de Cartera y de Inventarios no han expedido su propio reglamento",Confusión entre el contenido de un reglamento y la Resolución que adopta los Comités,
101,22,clchauxq1,El Comité de Se,,SGGC,"El Comité de Seguimiento y Control Financiero, presenta un Reglamento Interno, firmado en reunión del Comité el 19 de septiembre de 2012, según Acta No 9, dando cumplimiento a la Resolución 1463 de 2012 ""Por la cual se modifica y articula el Sistema de Coordinación Interna del IDU"" la cual fue derogada por la resolucion 22477 de 2014.","Se derogó la Resolucion 1463 de 2013 ""Por la cual se modifica y articula el Sistema de Coordinación Interna del IDU"" y se expide la Resolución 22477 de 2014 ""Por la cual se modifica y actualiza el Sistema de Coordinación Interna del IDU""",
102,22,clchauxq1,No hubo realiza,,SGGC,No hubo realización de las sesiones obligatorias estipuladas en la Resolución 22477 de 2014 por parte del Comité de Seguimiento y Control Financiero y el Comité de Sostenibilidad Contable,1. Cruce de agendas de los miembros del Comité de Seguimiento y Control Financiero,
103,22,clchauxq1,Inasistencia de,,SGGC,"Inasistencia del subdirector General Jurídico, Directora Técnica de Gestión Contractual y jefe de la Oficina Asesora de Planeación al Comité de Sostenibilidad Contable",1. Cruce de agendas de los miembros del Comité de Sostenibilidad Contable. No obstante lo anterior se dio cumplimiento a lo establecido por la resolución 22477 de 2014,
104,22,clchauxq1,El Comité de Se,,SGGC,El Comité de Seguimiento y Control Financiero está utilizando un formato de acta de reunión desactualizado.,desconocimiento del formato actualizado del acta de reunión.,
105,22,clchauxq1,Las actas del c,,SGGC,Las actas del comité de Seguimiento y Control Financiero y de inventarios evaluadas no registran evidencia del seguimiento y verificación al cumplimiento de los compromisos pactados en sesiones anteriores.,Falta de claridad en los tiempos de ejecución de los compromisos adquiridos,
106,22,clchauxq1,La Secretaría T,,SGGC,"La Secretaría Técnica del Comité de la Subdirección General de Gestión Corporativa, corresponde a la Subdirección Técnica de Recursos Tecnológicos, sin embargo, sus funciones las está desempeñando directamente esta Subdirección General.",Facilidad para que el Subdirector General haga seguimiento a los compromisos pactados,
107,23,ccrussis1,Se observó con ,,SGGC,"Se observó con base en la información consultada en el Sistema de Información y Acompañamiento Contractual - SIAC, que la Subdirección General de gestión Corporativa presenta los siguientes treinta y tres (33) contratos y/o convenios, los cuales según cálculo efectuado por esta Oficina tomando la fecha de terminación proyectada de ejecución registrada en el SIAC y con base en el plazo estipulado considerando las prórrogas otorgadas para los contratos que no presentan fecha de registro en el sistema (Figuran contratos con fechas de suscripción desde los años 2000 al 2010)","1. Deficiencias en las obligaciones de la supervisión de los contratos.
 2. Deficiencias en el proceso de reestructuración administrativa en el año 2009.
 3. Insuficiente trazabilidad de los proesos de contratación anteriores.
 4. Inadecuado proeso de actualización de la infromación en el SIAC por parte de los responsables",
108,24,ccbernal2,Fortalecer los ,,DTPS,Fortalecer los controles y/o cambiar el estatus de la calificación y/o nivel de riesgo residual a los riesgos con código R.SC.02 - Deficiente estructuración de los pliegos de condiciones por la falta de documentos en las carpetas de los archivos de los procesos contractuales y el incumplimientos a los tiempos establecidos dentro de los procedimientos internos del Instituto ,Falta de fortalecimiento de la matriz de riesgos del proceso,
109,24,ccbernal2,Incluir en la M,,DTPS,"Incluir en la Matriz de Riesgos de Gestión de la Dirección Técnica de Procesos Selectivos los riesgos relacionados con: Omisión o no publicación oportuna en el SECOP y CAV, Desactualización o falta de concordancia de la información que se reporta en el aplicativo SIAC y en los portales de contratación",No estan incluidos los  riesgos de publicación en la matriz de riesgos del proceso,
110,24,ccbernal2,Incorporar en e,,DTPS,"Incorporar en el Manual de Gestión Contractual y los procedimientos la normatividad aplicable al proceso en especial la relacionada con el Decreto Único Reglamentario 1082 de 2015. Lo anterior, con el fin de garantizar el cumplimiento normativo y la adecuada realización de los procesos",Desactualización de procedimientos,
111,24,ccbernal2,Generar control,,DTPS,"Generar controles frente al registro de la información en el Sistema de Información de Acompañamiento Contractual – SIAC, en aras de contar con información fidedigna que permita hacer adecuado seguimiento de la contratación y que suministre información estadística veraz","Faltan revisiones, una guia que permita documentar todos los procesos igual",
112,24,ccbernal2,Hacer seguimien,,DTPS,"Hacer seguimiento y actualizar la información correspondiente a los expedientes del Sistema de Gestión Documental - Orfeo, lo anterior dando cumplimiento a las obligaciones establecidos en la Ley General de Archivos (AGN), en la cual manifiesta que “Los secretarios generales o los funcionarios administrativos de igual o superior jerarquía, pertenecientes a las entidades públicas, a cuyo cargo estén los archivos públicos, tendrán la obligación de velar por la integridad, autenticidad, veracidad y fidelidad de la información de los documentos de archivo y serán responsables de su organización y conservación, así como de la prestación de los servicios archivísticos","Faltan revisiones, una guia que permita documentar todos los procesos igual",
113,24,ccbernal2,Mantener actual,,DTPS,"Mantener actualizada, las bases en Excel que manejan la Dirección Técnica de Procesos Selectivos, en las cuales reportan los tiempos en que se reciben las solicitudes de contratación y las aclaraciones toda vez que la no congruencia en las fechas afecta la medición de sus indicadores","Faltan revisiones, una guia que permita documentar todos los procesos igual",
114,24,ccbernal2,La información ,,DTGC,"La información registrada en el SIAC no es consistente con lo reportado en el SECOP, la fecha del inicio del contrato reportada en SIAC no es coherente con la reportada en el SECOP","Las áreas técnicas no informan a la Dirección Técnica de Gestión Contractual oportunamente el inicio de los contratos, por lo que para cumplir con los términos de publicación (Tres días hábiles) se realiza el registro de la información en el portal con la fecha de suscripción   y no se realiza el seguimiento a los registros ingresados en el portal con el fin de realizar la actualización correspondiente.",
115,25,pwherrer1,Actividades de ,,DTC,Actividades de interventoria no realizadas durante la etapa de ejecución de la obra.,"En la fecha de la suscripción del Acta 123 (Terminación de obra e inicio de la etapa de mantenimiento del contrato principal), Poyry no ejercía como interventor del contrato adicional (Proyectos 123 y 124 Valorización).",
116,26,peussaga1,Publicar de man,,DTPS ,Publicar de manera oportuna todos los documentos vinculados al proceso de selección en su etapa precontractual.,"Falta de instrucciones claras, asignación de responsables directos",
117,26,peussaga1,Verificicar que,,DTPS ,Verificicar que los documentos se encuentren debidamente suscritos antes de publicarse en los portales de contatación ,Falta revisión de la persona que genera el documento y del personal de la sala de consulta que es encargada de la publicación ,
118,26,peussaga1,Actualizar la m,,DTPS ,Actualizar la matriz de procedimiento  de registro de información a portales SIAC-SICE-CAV-SECOP consolidada OAP V2.0,Desconocimiento de la matriz por parte de las áreas involucradas.,
119,26,peussaga1,Conciliar en la,,SGJ ,Conciliar en la contabilidad los pagos deriviados de los constratos suscritos por el IDU con Francisco Sintura Varela Abogados S.A y Gomez Gómez Abogados Limitada.,"Los pagos realizados con recurso IDU, han sido cargados en el sistema de Informacion Contractual, en el aplicativo de control financiero del contrato; mientras que los pagos realizados con recursos Transmilenio no se han cargado al Sistema.",
120,27,plleiva1,Analizar la nec,,STEST,Analizar la necesidad de incorporar dentro de los pliegos de condiciones factores excepcionales que puedan modificar las condiciones licitatorias,No se tuvieron en cuenta estos factores,
121,27,plleiva1,Evaluar la pert,,STEST,Evaluar la pertinencia de actualizar la Cartilla de puentes,La Cartilla de Puentes no ha tenido una actualización reciente,
122,28,plleiva1,Realizar una ad,,STEST,Realizar una adecuada estructuración de los pliegos de condiciones junto con estudios y diseños que permitan establecer la viavilidad del proyecto,"Se deben ejecutar ítems no previstos, matores cantidades de obra y se debe conciderar tiempos en la aprovación con las entidades",
123,29,cnforero2,Durante la veri,,STRH,"Durante la verificación realizada a las evaluaciones del desempeño laboral se observó que se estan utilizando dos formatos de planes de mejoramiento individuales, uno el FO-GAF-128 el cual se encuentra derogado y el otro el FO-TH-14 que se encuentra vigente y publicado a través del flash IDU del 01 de octubre de 2014.","Falta de compromiso por parte de los evaluadores y evaluados para la utilización de los formatos actualizados de Plan de Mejoramiento Individual, a pesar de haber sido socializado en el mes de octubre.",
124,29,cnforero2,Durante la eval,,STRH,"Durante la evaluación realizada se evidencíó que en Recursos Humanos no se le registra la fecha de recibido a cada una de las evaluaciones de desempeño laboral, por lo tanto no es posible observar la oportunidad y el cumplimiento de las áreas en la entrega de las mismas.","En el momento de la recepción del formato de evaluación de desempeño laboral, no se consideraba relevante fechar el recibido, debido a que la entrega se hace de forma masiva. ",
125,29,cnforero2,Durante la eval,,STRH,Durante la evaluación realizada se pudo evidenciar mediante consultas a las hojas de vida que hay demoras en las entregas de las evaluaciones de desempeño laboral para el archivo de las mismas hasta dos (2) años después de la realización de la evaluación según las fechas que se encuentran en los formatos.,"Los formatos de evaluación, correpondientes a los años 2013 y 2014, no se enviaban a la hoja de vida, debido a que se esperaba la terminación del proceso de evaluación, para conocer la tranzabilidad de cada uno de los evaluados, por cambios de evaluadores, encargos, licencias o cambio de compromisos laborales.",
126,29,cnforero2,De 46 carpetas ,,STRH,"De 46 carpetas de las hojas de vida revisadas 15 (32,6%) no presentan la fijación de compromisos, 2 (13,3%) se encontraban en el área de Recursos Humanos pero no estaban incluidas en la carpeta del funcionario, las demás no habían sido entregadas por las dependencias.",La fijación de compromisos no fueron remitir a la hoja de vida debido a que se encontraban en revisión en las diferentes areas de cada uno de los compromisos laborales con el fin de definir las metas de cada uno de los funcionarios. ,
127,29,cnforero2,"En 8 de 46 (17,",,STRH,"En 8 de 46 (17,4%) carpetas examinadas se evidenció que los planes de mejoramiento son iguales año tras año, lo que demuestra falta de seguimiento real por parte de los jefes y la falta de compromiso de seguir mejorando por parte de los funcionarios .",Falta de compromiso de los evaluados y evaluadores al realizar el seguimiento del plan de mejoramiento de los funcionarios con el fin de fortalecer las competencias de cada uno de ellos.,
128,29,cnforero2,"5 de 46 (10,9%)",,STRH,"5 de 46 (10,9%) presentan los formatos de evaluación de desempeño laboral implementados por la Comisión Nacional del Servicio Civil con información incompleta o sin firma de los responsables de las mismas.",Falta de compromiso de los evaluados y evaluadores al realizar el diligenciamiento de los formatos.,
129,29,cnforero2,"En 5 de 46 (10,",,STRH,"En 5 de 46 (10,9%) carpetas de las hojas de vida revisadas se envideció que las fechas descritas en los formatos no corresponden a los períodos evaluados",Falta de compromiso de los evaluados y evaluadores al realizar el diligenciamiento de los formatos.,
130,29,cnforero2,Las calificacio,,STRH,"Las calificaciones observadas durante la revisión no tienen relación con los indicadores presentados durante el año 2014 ya que varias de las áreas no cumplieron con las metas, pero las calificaciones de los funcionarios de planta en casi un 100% presentan cumplimiento superiores a 90%",Los directivos no son consecuentes al evaluar al funcionario  tanto con las metas de la dependencia como las individuales.,
131,29,cnforero2,El mapa de reis,,STRH,El mapa de reisgos de la Subdirección Técnica de Recursos Humanos no incorpora ningún riesgo al respecto y como se mencionó en el punto 4. en algunos casos la entrega de las evaluaciones de desempeño laboral se ha demorado años para su archivo por tal razón existe riesgo que estas se puedan refundir,"En el mapa de riesgos actual de la STRH no registra este riesgo, porque no se consideró relevante",
132,30,pwherrer1,Consolidar los ,,OAP,"Consolidar los resultados de la gestión adelantada en la vigencia en relación con  las actividades de Inducción y/o reinducción, a través de un documento que evidencie las actividades, los resultados y las conclusiones.","Falta de socialización eficiente frente a los productos requeridos (informes), adicionalmente esta información está contenida en el informe anual por áreas.",
133,30,pwherrer1,Implementar ins,,OAP,"Implementar instrumentos y levantar los registros pertinentes  para medir la satisfacción en relación con las actividades de inducción, reinducción, entrenamiento y capacitación.","Falta de socialización eficiente frente a los productos requeridos (informes), adicionalmente esta información está contenida en el informe anual por áreas.",
134,30,pwherrer1,Está pendiente ,,OAP,"Está pendiente la adopción de instrumentos o el diligenciamiento de registros que evidencien la evaluación de los programas de capacitación, bienestar e incentivos.",Deficiente socialización de los instrumentos de evaluación.,
135,30,pwherrer1,Realizar activi,,OAP,"Realizar actividades de socialización de los valores y principios éticos, a partir de la adopción de la cartilla ""Acuerdo Ético Gente IDU"".","Se realizó la divulgación de la cartilla de acuerdo ético, encontrándose pendiente su socialización, debido a que la OAC se encuentra en proceso de diagramación del entregable.",
136,30,pwherrer1,Formular un pla,,OAP,"Formular un plan de gestión ética, de manera que se implementen y adopten estrategias y actividades para lograr uno de los nuevos objetivos estratégicos formulados ""Dirigir la gestión del IDU hacia una entidad transparente , fortalecida, coordinada y dinámica con el fin de asumir los retos de la Bogotá Humana"". ","Las acciones del Plan de Gestión Ética 2015, se encuentran formuladas en la estrategia PREMI, liderada por la Secretaria General de la Alcaldía, pero no se han formalizado al interior del Instituto.",
137,30,pwherrer1,Fortalecer las ,,OAP,"Fortalecer las actividades de gestión ética para la vigencia 2015, con el fin de lograr integralidad en las acciones institucionales.","Las acciones del Plan de Gestión Ética 2015, se encuentran formuladas en la estrategia PREMI, liderada por la Secretaria General de la Alcaldía, pero no se han formalizado al interior del Instituto.",
138,30,pwherrer1,Implementar est,,OAP,Implementar estrategias de comunicación para socializar los resultados de la gestión institucional en el ámbito interno.,"No generar espacios para dar a conocer la información
No contar con lineamiento claro frente a publicación de la información",
139,30,pwherrer1,Socializar el p,,OAP,"Socializar el plan de comunicaciones de la vigencia 2015, debido al nuevo enfoque de la OAC, donde algunas actividades y estrategias planteadas para el 2014 se reestructurarán para el 2015, las cuales se adaptaran a los recursos y necesidades de la oficina. ","No se formuló
Ver seguimiento OCI",
140,30,pwherrer1,El plan de actu,,OAP,"El plan de actualización documental que se adelantó en 2014 con todas las dependencias del Instituto no se ejecutó al 100%, con corte al 31 de enero de 2015 alcanzó un avance del 91%. ","Demoras en trámites de elaboración, revisión y aprobación de documentos ",
141,30,pwherrer1,Finalizar y con,,OAP,Finalizar y consolidar los informes a que haya lugar en relación con la implementación del instrumento autoevaluación institucional.,"No se contaba con metodología clara para elaboración del informe, por tratarse de un tema nuevo a implementar en el Instituto.
Desconocimiento de la utilidad del tema por parte de las dependencias y directivos",
142,30,pwherrer1,"Elaborar, socia",,OAP,"Elaborar, socializar e implementar la metodología para la identificación, gestión y manejo de alertas de los riesgos de corrupción de la Entidad.

Documentar el procedimiento que indique las etapas de administración de riesgos en el IDU",Desconocimiento de la utilidad del tema por parte de las dependencias y directivos,
143,30,pwherrer1,Complementar la,,OAP,"Complementar la documentación existente incluyendo el aspecto relativo a los informes de gestión de que trata la ley 951 de 2005, que tiene que ver la entrega y recepción de los asuntos y recursos públicos del Estado colombiano, establecer la obligación para que los servidores públicos en el orden nacional,  departamental, distrital, municipal, metropolitano en calidad de titulares y representantes legales, así como los particulares que administren fondos o bienes del Estado presenten al separarse de sus cargos o al finalizar la administración.","Desactualización de la normatividad
No se considero indispensable documentar el tema por encontrarse explícito en la norma",
144,30,pwherrer1,Socializar los ,,OAP,Socializar los resultados de las auditorías realizadas al cumplimiento de decreto 371 de 2010 en el Comité Directivo de SIG en la vigencia 2015.,En la vigencia 2014 no aplicaba la socialización de los resultados de la evaluación  al cumplimiento de decreto 371/10,
145,30,pwherrer1,Implementar en ,,OAP,"Implementar en la vigencia 2015 la evaluación de la efectividad de las acciones correctivas incluidas en los planes de mejoramiento interno y/o por procesos y los planes de mejoramiento con los organismos de control.

Dado que a la fecha se evalúa el cumplimiento y avance en los planes de mejoramiento, tanto internos como externos, se identificó la necesidad de establecer acciones que permitan evaluar la eficacia y efectividad de las acciones formuladas.","La evaluación de  la eficacia de las acciones correctivas formuladas en los planes de mejoramiento se estableció como política operacional en el procedimiento ajustado en la vigencia 2014, dado lo cual aun está en proceso de ser implementado al 100%",
146,30,pwherrer1,Dentro del conc,,OAP,"Dentro del concepto MECI de plan de mejoramiento institucional, está pendiente la adopción formal de acciones estratégicas implementadas por la entidad, conforme a dicho esquema.  ",Para la vigencia 2014 la OAP trabajo la actualización de los productos MECI con base en la elaboración de un plan de acción; por lo que no se consideró la elaboración de un plan de mejoramiento adicional.,
147,30,pwherrer1,Que las Depende,,OAP,"Que las Dependencias presenten los planes de mejoramiento conforme a la oportunidad establecida, dado que el no tomar acciones oportunamente afecta el nivel de servicio de los procesos y el mejoramiento institucional.","Desconocimiento de los instrumentos, documentos, normatividad y metodología que regulan la formulación, desarrollo y cumplimiento de los Planes de Mejoramiento Internos y con los organismos de control.",
148,31,ccrussis1,IDU-50-2012 la ,,DTD,IDU-50-2012 la no liquidación del contrato a la fecha,"Pendiente permiso ocupación de cauce por parte de la Secreatria Distrital de Ambiente
Pendiente trámite de cesión de derechos de autor.
Pendiente la entrega del informe consolidado social atendiendo las observaciones de la DTD,  por parte del Consultor.
Pendiente informe presupuesto y APUs con observaciones por parte del consultor.
Pendiente informe especificaciones técnicas de construcción con observaciones por parte del consultor.
Pendiente informe ejecutivo por parte del consultor.
Pendiente los planos definitivos en formato SCAD GIS por parte del consultor.
Pendiente programación de obra por parte del consultor.
Pendiente documentos técnicos para pliegos por parte del consultor.",
149,31,ccrussis1,        IDU-043,,DTD,"        IDU-043-2012, La no liquidación del contrato a la fecha","Pendiente entrega por parte del consultor, del número del proyecto de la EAB - DITG aprobado.
Radicación por parte del Consultor de la cesión de derechos de autor.
En proceso Administrativo por posibles incumplimientos, Clausula Penal Pecuniaria
Pendiente trámite de informe final
No se cuenta con el Acta de liquidación",
